{
  "schema_version": 1,
  "source_request_hash": "sha256:3bb4869e620168fb0fa943c328e85b83c5afbde96d10961550706b69ad17b96c",
  "task_hash": "sha256:0101010101010101010101010101010101010101010101010101010101010101",
  "trace_id": "00000000-0000-0000-0000-000000000002",
  "evaluation_profile": "PRE_EXECUTION",
  "stage": "REQUEST",
  "provider_id_hash": "sha256:1515151515151515151515151515151515151515151515151515151515151515",
  "egress_policy_hash": "sha256:1616161616161616161616161616161616161616161616161616161616161616",
  "provider_trust_root": "sha256:9f45f340a4f5afe555ab89777dc6fc49bae281b2534dca42d9ad4758ccb0f6a7",
  "challenge_hash": "sha256:0c0c0c0c0c0c0c0c0c0c0c0c0c0c0c0c0c0c0c0c0c0c0c0c0c0c0c0c0c0c0c0c",
  "authority_key_id": "egress-authority-v1",
  "egress_authority_root": "sha256:92d2f44344852a2c5cc9c2c869f4ee5b7de7b3a81601cebfb58468a0975686b6",
  "issued_at": 1105,
  "valid_until": 1300,
  "cose_sign1": [
    132,
    88,
    24,
    162,
    1,
    39,
    4,
    83,
    101,
    103,
    114,
    101,
    115,
    115,
    45,
    97,
    117,
    116,
    104,
    111,
    114,
    105,
    116,
    121,
    45,
    118,
    49,
    160,
    89,
    1,
    79,
    143,
    1,
    88,
    32,
    59,
    180,
    134,
    158,
    98,
    1,
    104,
    251,
    15,
    169,
    67,
    195,
    40,
    232,
    91,
    131,
    197,
    175,
    189,
    233,
    109,
    16,
    150,
    21,
    80,
    112,
    107,
    105,
    173,
    23,
    185,
    108,
    88,
    32,
    1,
    1,
    1,
    1,
    1,
    1,
    1,
    1,
    1,
    1,
    1,
    1,
    1,
    1,
    1,
    1,
    1,
    1,
    1,
    1,
    1,
    1,
    1,
    1,
    1,
    1,
    1,
    1,
    1,
    1,
    1,
    1,
    80,
    0,
    0,
    0,
    0,
    0,
    0,
    0,
    0,
    0,
    0,
    0,
    0,
    0,
    0,
    0,
    2,
    0,
    0,
    88,
    32,
    21,
    21,
    21,
    21,
    21,
    21,
    21,
    21,
    21,
    21,
    21,
    21,
    21,
    21,
    21,
    21,
    21,
    21,
    21,
    21,
    21,
    21,
    21,
    21,
    21,
    21,
    21,
    21,
    21,
    21,
    21,
    21,
    88,
    32,
    22,
    22,
    22,
    22,
    22,
    22,
    22,
    22,
    22,
    22,
    22,
    22,
    22,
    22,
    22,
    22,
    22,
    22,
    22,
    22,
    22,
    22,
    22,
    22,
    22,
    22,
    22,
    22,
    22,
    22,
    22,
    22,
    88,
    32,
    159,
    69,
    243,
    64,
    164,
    245,
    175,
    229,
    85,
    171,
    137,
    119,
    125,
    198,
    252,
    73,
    186,
    226,
    129,
    178,
    83,
    77,
    202,
    66,
    217,
    173,
    71,
    88,
    204,
    176,
    246,
    167,
    88,
    32,
    12,
    12,
    12,
    12,
    12,
    12,
    12,
    12,
    12,
    12,
    12,
    12,
    12,
    12,
    12,
    12,
    12,
    12,
    12,
    12,
    12,
    12,
    12,
    12,
    12,
    12,
    12,
    12,
    12,
    12,
    12,
    12,
    115,
    101,
    103,
    114,
    101,
    115,
    115,
    45,
    97,
    117,
    116,
    104,
    111,
    114,
    105,
    116,
    121,
    45,
    118,
    49,
    88,
    32,
    146,
    210,
    244,
    67,
    68,
    133,
    42,
    44,
    92,
    201,
    194,
    200,
    105,
    244,
    238,
    91,
    125,
    231,
    179,
    168,
    22,
    1,
    206,
    191,
    181,
    132,
    104,
    160,
    151,
    86,
    134,
    182,
    25,
    4,
    81,
    25,
    5,
    20,
    120,
    48,
    97,
    99,
    99,
    111,
    114,
    100,
    108,
    111,
    99,
    107,
    58,
    118,
    49,
    58,
    101,
    120,
    116,
    101,
    114,
    110,
    97,
    108,
    45,
    101,
    118,
    105,
    100,
    101,
    110,
    99,
    101,
    45,
    100,
    105,
    115,
    99,
    108,
    111,
    115,
    117,
    114,
    101,
    45,
    103,
    114,
    97,
    110,
    116,
    88,
    64,
    98,
    249,
    133,
    202,
    107,
    96,
    166,
    243,
    182,
    136,
    41,
    1,
    80,
    81,
    3,
    132,
    175,
    230,
    12,
    32,
    128,
    154,
    72,
    215,
    73,
    205,
    167,
    124,
    81,
    49,
    39,
    154,
    198,
    218,
    231,
    0,
    240,
    61,
    17,
    91,
    174,
    6,
    157,
    193,
    7,
    127,
    19,
    117,
    173,
    6,
    119,
    84,
    162,
    145,
    163,
    23,
    234,
    170,
    10,
    165,
    192,
    240,
    148,
    7
  ]
}
